Question,Tag
Check if There is a Valid Partition For The Array,monotonic-stack
Trapping Rain Water,monotonic-stack
Largest Rectangle in Histogram,monotonic-stack
Maximal Rectangle,monotonic-stack
Verify Preorder Sequence in Binary Search Tree,monotonic-stack
Remove Duplicate Letters,monotonic-stack
Create Maximum Number,monotonic-stack
Remove K Digits,monotonic-stack
132 Pattern,monotonic-stack
Next Greater Element I,monotonic-stack
Next Greater Element II,monotonic-stack
Shortest Unsorted Continuous Subarray,monotonic-stack
Maximum Binary Tree,monotonic-stack
Daily Temperatures,monotonic-stack
Max Chunks To Make Sorted II,monotonic-stack
Max Chunks To Make Sorted,monotonic-stack
Car Fleet,monotonic-stack
Online Stock Span,monotonic-stack
Sum of Subarray Minimums,monotonic-stack
Maximum Width Ramp,monotonic-stack
Odd Even Jump,monotonic-stack
Construct Binary Search Tree from Preorder Traversal,monotonic-stack
Next Greater Node In Linked List,monotonic-stack
Number of Valid Subarrays,monotonic-stack
Smallest Subsequence of Distinct Characters,monotonic-stack
Longest Well-Performing Interval,monotonic-stack
Minimum Cost Tree From Leaf Values,monotonic-stack
Final Prices With a Special Discount in a Shop,monotonic-stack
Count Submatrices With All Ones,monotonic-stack
Minimum Number of Increments on Subarrays to Form a Target Array,monotonic-stack
Shortest Subarray to be Removed to Make Array Sorted,monotonic-stack
Find the Most Competitive Subsequence,monotonic-stack
Buildings With an Ocean View,monotonic-stack
Car Fleet II,monotonic-stack
Maximum Score of a Good Subarray,monotonic-stack
Maximum Subarray Min-Product,monotonic-stack
Number of Visible People in a Queue,monotonic-stack
Maximum of Minimum Values in All Subarrays,monotonic-stack
The Number of Weak Characters in the Game,monotonic-stack
Smallest K-Length Subsequence With Occurrences of a Letter,monotonic-stack
Sum of Subarray Ranges,monotonic-stack
Sum of Total Strength of Wizards,monotonic-stack
Number of People That Can Be Seen in a Grid,monotonic-stack
Steps to Make Array Non-decreasing,monotonic-stack
Jump Game VIII,monotonic-stack
Subarray With Elements Greater Than Varying Threshold,monotonic-stack
Finding the Number of Visible Mountains,monotonic-stack
Maximum Number of Books You Can Take,monotonic-stack
Next Greater Element IV,monotonic-stack
Remove Nodes From Linked List,monotonic-stack
