Question,Tag
Check if There is a Valid Partition For The Array,binary-tree
Binary Tree Inorder Traversal,binary-tree
Unique Binary Search Trees II,binary-tree
Unique Binary Search Trees,binary-tree
Validate Binary Search Tree,binary-tree
Recover Binary Search Tree,binary-tree
Same Tree,binary-tree
Symmetric Tree,binary-tree
Binary Tree Level Order Traversal,binary-tree
Binary Tree Zigzag Level Order Traversal,binary-tree
Maximum Depth of Binary Tree,binary-tree
Construct Binary Tree from Preorder and Inorder Traversal,binary-tree
Construct Binary Tree from Inorder and Postorder Traversal,binary-tree
Binary Tree Level Order Traversal II,binary-tree
Convert Sorted Array to Binary Search Tree,binary-tree
Convert Sorted List to Binary Search Tree,binary-tree
Balanced Binary Tree,binary-tree
Minimum Depth of Binary Tree,binary-tree
Path Sum,binary-tree
Path Sum II,binary-tree
Flatten Binary Tree to Linked List,binary-tree
Populating Next Right Pointers in Each Node,binary-tree
Populating Next Right Pointers in Each Node II,binary-tree
Binary Tree Maximum Path Sum,binary-tree
Sum Root to Leaf Numbers,binary-tree
Binary Tree Preorder Traversal,binary-tree
Binary Tree Postorder Traversal,binary-tree
Binary Tree Upside Down,binary-tree
Binary Search Tree Iterator,binary-tree
Binary Tree Right Side View,binary-tree
Count Complete Tree Nodes,binary-tree
Invert Binary Tree,binary-tree
Kth Smallest Element in a BST,binary-tree
Lowest Common Ancestor of a Binary Search Tree,binary-tree
Lowest Common Ancestor of a Binary Tree,binary-tree
Count Univalue Subtrees,binary-tree
Verify Preorder Sequence in Binary Search Tree,binary-tree
Binary Tree Paths,binary-tree
Closest Binary Search Tree Value,binary-tree
Closest Binary Search Tree Value II,binary-tree
Inorder Successor in BST,binary-tree
Serialize and Deserialize Binary Tree,binary-tree
Binary Tree Longest Consecutive Sequence,binary-tree
Binary Tree Vertical Order Traversal,binary-tree
Verify Preorder Serialization of a Binary Tree,binary-tree
Largest BST Subtree,binary-tree
House Robber III,binary-tree
Find Leaves of Binary Tree,binary-tree
Sum of Left Leaves,binary-tree
Convert Binary Search Tree to Sorted Doubly Linked List,binary-tree
Check if There is a Valid Partition For The Array,binary-tree
Binary Tree Inorder Traversal,binary-tree
Unique Binary Search Trees II,binary-tree
Unique Binary Search Trees,binary-tree
Validate Binary Search Tree,binary-tree
Recover Binary Search Tree,binary-tree
Same Tree,binary-tree
Symmetric Tree,binary-tree
Binary Tree Level Order Traversal,binary-tree
Binary Tree Zigzag Level Order Traversal,binary-tree
Maximum Depth of Binary Tree,binary-tree
Construct Binary Tree from Preorder and Inorder Traversal,binary-tree
Construct Binary Tree from Inorder and Postorder Traversal,binary-tree
Binary Tree Level Order Traversal II,binary-tree
Convert Sorted Array to Binary Search Tree,binary-tree
Convert Sorted List to Binary Search Tree,binary-tree
Balanced Binary Tree,binary-tree
Minimum Depth of Binary Tree,binary-tree
Path Sum,binary-tree
Path Sum II,binary-tree
Flatten Binary Tree to Linked List,binary-tree
Populating Next Right Pointers in Each Node,binary-tree
Populating Next Right Pointers in Each Node II,binary-tree
Binary Tree Maximum Path Sum,binary-tree
Sum Root to Leaf Numbers,binary-tree
Binary Tree Preorder Traversal,binary-tree
Binary Tree Postorder Traversal,binary-tree
Binary Tree Upside Down,binary-tree
Binary Search Tree Iterator,binary-tree
Binary Tree Right Side View,binary-tree
Count Complete Tree Nodes,binary-tree
Invert Binary Tree,binary-tree
Kth Smallest Element in a BST,binary-tree
Lowest Common Ancestor of a Binary Search Tree,binary-tree
Lowest Common Ancestor of a Binary Tree,binary-tree
Count Univalue Subtrees,binary-tree
Verify Preorder Sequence in Binary Search Tree,binary-tree
Binary Tree Paths,binary-tree
Closest Binary Search Tree Value,binary-tree
Closest Binary Search Tree Value II,binary-tree
Inorder Successor in BST,binary-tree
Serialize and Deserialize Binary Tree,binary-tree
Binary Tree Longest Consecutive Sequence,binary-tree
Binary Tree Vertical Order Traversal,binary-tree
Verify Preorder Serialization of a Binary Tree,binary-tree
Largest BST Subtree,binary-tree
House Robber III,binary-tree
Find Leaves of Binary Tree,binary-tree
Sum of Left Leaves,binary-tree
Convert Binary Search Tree to Sorted Doubly Linked List,binary-tree
Path Sum III,binary-tree
Serialize and Deserialize BST,binary-tree
Delete Node in a BST,binary-tree
Find Mode in Binary Search Tree,binary-tree
Most Frequent Subtree Sum,binary-tree
Inorder Successor in BST II,binary-tree
Find Bottom Left Tree Value,binary-tree
Find Largest Value in Each Tree Row,binary-tree
Minimum Absolute Difference in BST,binary-tree
Construct Binary Tree from String,binary-tree
Convert BST to Greater Tree,binary-tree
Diameter of Binary Tree,binary-tree
Boundary of Binary Tree,binary-tree
Binary Tree Longest Consecutive Sequence II,binary-tree
Binary Tree Tilt,binary-tree
Subtree of Another Tree,binary-tree
Construct String from Binary Tree,binary-tree
Merge Two Binary Trees,binary-tree
Add One Row to Tree,binary-tree
Average of Levels in Binary Tree,binary-tree
Find Duplicate Subtrees,binary-tree
Two Sum IV - Input is a BST,binary-tree
Maximum Binary Tree,binary-tree
Print Binary Tree,binary-tree
Maximum Width of Binary Tree,binary-tree
Equal Tree Partition,binary-tree
Path Sum IV,binary-tree
Trim a Binary Search Tree,binary-tree
Second Minimum Node In a Binary Tree,binary-tree
Longest Univalue Path,binary-tree
Search in a Binary Search Tree,binary-tree
Insert into a Binary Search Tree,binary-tree
Kth Largest Element in a Stream,binary-tree
Closest Leaf in a Binary Tree,binary-tree
Split BST,binary-tree
Minimum Distance Between BST Nodes,binary-tree
Binary Tree Pruning,binary-tree
All Nodes Distance K in Binary Tree,binary-tree
Smallest Subtree with all the Deepest Nodes,binary-tree
Leaf-Similar Trees,binary-tree
Construct Binary Tree from Preorder and Postorder Traversal,binary-tree
All Possible Full Binary Trees,binary-tree
Increasing Order Search Tree,binary-tree
Complete Binary Tree Inserter,binary-tree
Range Sum of BST,binary-tree
Flip Equivalent Binary Trees,binary-tree
Check Completeness of a Binary Tree,binary-tree
Univalued Binary Tree,binary-tree
Binary Tree Cameras,binary-tree
Flip Binary Tree To Match Preorder Traversal,binary-tree
Distribute Coins in Binary Tree,binary-tree
Vertical Order Traversal of a Binary Tree,binary-tree
Smallest String Starting From Leaf,binary-tree
Cousins in Binary Tree,binary-tree
Maximum Binary Tree II,binary-tree
Construct Binary Search Tree from Preorder Traversal,binary-tree
Sum of Root To Leaf Binary Numbers,binary-tree
Maximum Difference Between Node and Ancestor,binary-tree
Recover a Tree From Preorder Traversal,binary-tree
Binary Search Tree to Greater Sum Tree,binary-tree
Insufficient Nodes in Root to Leaf Paths,binary-tree
Path In Zigzag Labelled Binary Tree,binary-tree
Delete Nodes And Return Forest,binary-tree
Maximum Average Subtree,binary-tree
Lowest Common Ancestor of Deepest Leaves,binary-tree
Binary Tree Coloring Game,binary-tree
Maximum Level Sum of a Binary Tree,binary-tree
Two Sum BSTs,binary-tree
Find Elements in a Contaminated Binary Tree,binary-tree
Deepest Leaves Sum,binary-tree
All Elements in Two Binary Search Trees,binary-tree
Sum of Nodes with Even-Valued Grandparent,binary-tree
Delete Leaves With a Given Value,binary-tree
Maximum Product of Splitted Binary Tree,binary-tree
Validate Binary Tree Nodes,binary-tree
Linked List in Binary Tree,binary-tree
Longest ZigZag Path in a Binary Tree,binary-tree
Maximum Sum BST in Binary Tree,binary-tree
Find a Corresponding Node of a Binary Tree in a Clone of That Tree,binary-tree
Balance a Binary Search Tree,binary-tree
Check If a String Is a Valid Sequence from Root to Leaves Path in a Binary Tree,binary-tree
Count Good Nodes in Binary Tree,binary-tree
Pseudo-Palindromic Paths in a Binary Tree,binary-tree
Find All The Lonely Nodes,binary-tree
Clone Binary Tree With Random Pointer,binary-tree
Number of Good Leaf Nodes Pairs,binary-tree
Number of Ways to Reorder Array to Get Same BST,binary-tree
Binary Search Tree Iterator II,binary-tree
Build Binary Expression Tree From Infix Expression,binary-tree
Find Nearest Right Node in Binary Tree,binary-tree
Even Odd Tree,binary-tree
Check If Two Expression Trees are Equivalent,binary-tree
Design an Expression Tree With Evaluate Function,binary-tree
Lowest Common Ancestor of a Binary Tree II,binary-tree
Lowest Common Ancestor of a Binary Tree III,binary-tree
Correct a Binary Tree,binary-tree
Change the Root of a Binary Tree,binary-tree
Lowest Common Ancestor of a Binary Tree IV,binary-tree
Find Distance in a Binary Tree,binary-tree
Depth of BST Given Insertion Order,binary-tree
Merge BSTs to Create Single BST,binary-tree
Count Nodes Equal to Sum of Descendants,binary-tree
Subtree Removal Game with Fibonacci Tree,binary-tree
Count Nodes With the Highest Score,binary-tree
Step-By-Step Directions From a Binary Tree Node to Another,binary-tree
Create Binary Tree From Descriptions,binary-tree
Root Equals Sum of Children,binary-tree
Count Nodes Equal to Average of Subtree,binary-tree
Minimum Flips in Binary Tree to Get Result,binary-tree
Evaluate Boolean Binary Tree,binary-tree
Amount of Time for Binary Tree to Be Infected,binary-tree
Reverse Odd Levels of Binary Tree,binary-tree
Number of Nodes With Value One,binary-tree
Height of Binary Tree After Subtree Removal Queries,binary-tree
Minimum Number of Operations to Sort a Binary Tree by Level,binary-tree
Closest Nodes Queries in a Binary Search Tree,binary-tree
Cycle Length Queries in a Tree,binary-tree
Cousins in Binary Tree II,binary-tree
Make Costs of Paths Equal in a Binary Tree,binary-tree
is Array a Preorder of Some ‌Binary Tree,binary-tree
