Question,Tag
Check if There is a Valid Partition For The Array,number-theory
Count Primes,number-theory
Add Digits,number-theory
Mirror Reflection,number-theory
X of a Kind in a Deck of Cards,number-theory
Largest Component Size by Common Factor,number-theory
Ugly Number III,number-theory
Check If It Is a Good Array,number-theory
Simplified Fractions,number-theory
The kth Factor of n,number-theory
Count Ways to Make Array With Product,number-theory
Maximize Score After N Operations,number-theory
Number of Different Subsequences GCDs,number-theory
Find Greatest Common Divisor of Array,number-theory
GCD Sort of an Array,number-theory
Number of Pairs of Interchangeable Rectangles,number-theory
Count Array Pairs Divisible by K,number-theory
Replace Non-Coprime Numbers in Array,number-theory
Minimum Lines to Represent a Line Chart,number-theory
Count the Number of Ideal Arrays,number-theory
