Question,Tag
Check if There is a Valid Partition For The Array,string-matching
Find the Index of the First Occurrence in a String,string-matching
Shortest Palindrome,string-matching
Repeated Substring Pattern,string-matching
Subtree of Another Tree,string-matching
Add Bold Tag in String,string-matching
Repeated String Match,string-matching
Bold Words in String,string-matching
Rotate String,string-matching
Camelcase Matching,string-matching
Longest Happy Prefix,string-matching
Find All Good Strings,string-matching
String Matching in an Array,string-matching
Check If a Word Occurs As a Prefix of Any Word in a Sentence,string-matching
Maximum Repeating Substring,string-matching
Form Array by Concatenating Subarrays of Another Array,string-matching
Sum of Scores of Built Strings,string-matching
Match Substring After Replacement,string-matching
Maximum Deletions on a String,string-matching
