Question,Tag
Check if There is a Valid Partition For The Array,sorting
3Sum,sorting
3Sum Closest,sorting
4Sum,sorting
Group Anagrams,sorting
Merge Intervals,sorting
Sort Colors,sorting
Merge Sorted Array,sorting
Insertion Sort List,sorting
Sort List,sorting
Maximum Gap,sorting
Majority Element,sorting
Largest Number,sorting
Kth Largest Element in an Array,sorting
Contains Duplicate,sorting
Contains Duplicate III,sorting
Majority Element II,sorting
Valid Anagram,sorting
Meeting Rooms,sorting
Meeting Rooms II,sorting
3Sum Smaller,sorting
Missing Number,sorting
H-Index,sorting
Wiggle Sort,sorting
Find Median from Data Stream,sorting
Best Meeting Point,sorting
Wiggle Sort II,sorting
Top K Frequent Elements,sorting
Intersection of Two Arrays,sorting
Intersection of Two Arrays II,sorting
Russian Doll Envelopes,sorting
Rearrange String k Distance Apart,sorting
Sort Transformed Array,sorting
Largest Divisible Subset,sorting
Kth Smallest Element in a Sorted Matrix,sorting
Find the Difference,sorting
Queue Reconstruction by Height,sorting
Third Maximum Number,sorting
Non-overlapping Intervals,sorting
Find Right Interval,sorting
Sort Characters By Frequency,sorting
Minimum Number of Arrows to Burst Balloons,sorting
Assign Cookies,sorting
Minimum Moves to Equal Array Elements II,sorting
Heaters,sorting
IPO,sorting
Relative Ranks,sorting
Longest Uncommon Subsequence II,sorting
Longest Word in Dictionary through Deleting,sorting
Word Abbreviation,sorting
Check if There is a Valid Partition For The Array,sorting
3Sum,sorting
3Sum Closest,sorting
4Sum,sorting
Group Anagrams,sorting
Merge Intervals,sorting
Sort Colors,sorting
Merge Sorted Array,sorting
Insertion Sort List,sorting
Sort List,sorting
Maximum Gap,sorting
Majority Element,sorting
Largest Number,sorting
Kth Largest Element in an Array,sorting
Contains Duplicate,sorting
Contains Duplicate III,sorting
Majority Element II,sorting
Valid Anagram,sorting
Meeting Rooms,sorting
Meeting Rooms II,sorting
3Sum Smaller,sorting
Missing Number,sorting
H-Index,sorting
Wiggle Sort,sorting
Find Median from Data Stream,sorting
Best Meeting Point,sorting
Wiggle Sort II,sorting
Top K Frequent Elements,sorting
Intersection of Two Arrays,sorting
Intersection of Two Arrays II,sorting
Russian Doll Envelopes,sorting
Rearrange String k Distance Apart,sorting
Sort Transformed Array,sorting
Largest Divisible Subset,sorting
Kth Smallest Element in a Sorted Matrix,sorting
Find the Difference,sorting
Queue Reconstruction by Height,sorting
Third Maximum Number,sorting
Non-overlapping Intervals,sorting
Find Right Interval,sorting
Sort Characters By Frequency,sorting
Minimum Number of Arrows to Burst Balloons,sorting
Assign Cookies,sorting
Minimum Moves to Equal Array Elements II,sorting
Heaters,sorting
IPO,sorting
Relative Ranks,sorting
Longest Uncommon Subsequence II,sorting
Longest Word in Dictionary through Deleting,sorting
Word Abbreviation,sorting
Minimum Time Difference,sorting
Array Partition,sorting
Shortest Unsorted Continuous Subarray,sorting
Longest Harmonious Subsequence,sorting
Valid Triangle Number,sorting
Task Scheduler,sorting
Maximum Product of Three Numbers,sorting
Course Schedule III,sorting
Smallest Range Covering Elements from K Lists,sorting
Set Mismatch,sorting
Maximum Length of Pair Chain,sorting
Find K Closest Elements,sorting
Top K Frequent Words,sorting
Random Pick with Blacklist,sorting
Find K-th Smallest Pair Distance,sorting
Longest Word in Dictionary,sorting
Number of Atoms,sorting
Largest Number At Least Twice of Others,sorting
Set Intersection Size At Least Two,sorting
Employee Free Time,sorting
Reorganize String,sorting
Max Chunks To Make Sorted II,sorting
Max Chunks To Make Sorted,sorting
K-th Smallest Prime Fraction,sorting
Custom Sort String,sorting
Number of Matching Subsequences,sorting
Friends Of Appropriate Ages,sorting
Most Profit Assigning Work,sorting
Find And Replace in String,sorting
Hand of Straights,sorting
Car Fleet,sorting
Minimum Cost to Hire K Workers,sorting
Reordered Power of 2,sorting
Advantage Shuffle,sorting
Boats to Save People,sorting
Fair Candy Swap,sorting
Sum of Subsequence Widths,sorting
Orderly Queue,sorting
Sort Array By Parity,sorting
Smallest Range II,sorting
Sort an Array,sorting
Sort Array By Parity II,sorting
3Sum With Multiplicity,sorting
Reorder Data in Log Files,sorting
Minimum Area Rectangle,sorting
Minimum Increment to Make Array Unique,sorting
Bag of Tokens,sorting
Reveal Cards In Increasing Order,sorting
Array of Doubled Pairs,sorting
Pancake Sorting,sorting
K Closest Points to Origin,sorting
Largest Perimeter Triangle,sorting
Squares of a Sorted Array,sorting
Maximize Sum Of Array After K Negations,sorting
Two City Scheduling,sorting
Matrix Cells in Distance Order,sorting
Moving Stones Until Consecutive II,sorting
Height Checker,sorting
Distant Barcodes,sorting
Campus Bikes,sorting
Index Pairs of a String,sorting
High Five,sorting
Largest Values From Labels,sorting
Car Pooling,sorting
Two Sum Less Than K,sorting
Relative Sort Array,sorting
Largest Unique Number,sorting
Analyze User Website Visit Pattern,sorting
Invalid Transactions,sorting
Compare Strings by Frequency of the Smallest Character,sorting
Before and After Puzzle,sorting
Make Array Strictly Increasing,sorting
How Many Apples Can You Put into the Basket,sorting
Minimum Absolute Difference,sorting
Meeting Scheduler,sorting
Maximum Profit in Job Scheduling,sorting
Design A Leaderboard,sorting
Greatest Sum Divisible by Three,sorting
Remove Covered Intervals,sorting
Divide Array in Sets of K Consecutive Numbers,sorting
Sum of Mutated Array Closest to Target,sorting
All Elements in Two Binary Search Trees,sorting
Get Watched Videos by Your Friends,sorting
Sort the Matrix Diagonally,sorting
Rank Transform of an Array,sorting
"Filter Restaurants by Vegan-Friendly, Price and Distance",sorting
The K Weakest Rows in a Matrix,sorting
Reduce Array Size to The Half,sorting
Jump Game V,sorting
Check If N and Its Double Exist,sorting
Tweet Counts Per Frequency,sorting
Maximum Number of Events That Can Be Attended,sorting
Sort Integers by The Number of 1 Bits,sorting
How Many Numbers Are Smaller Than the Current Number,sorting
Rank Teams by Votes,sorting
Maximum Performance of a Team,sorting
Find the Distance Value Between Two Arrays,sorting
Sort Integers by The Power Value,sorting
Reducing Dishes,sorting
Minimum Subsequence in Non-Increasing Order,sorting
Display Table of Food Orders in a Restaurant,sorting
Diagonal Traverse II,sorting
Check If a String Can Break Another String,sorting
Rearrange Words in a Sentence,sorting
Make Two Arrays Equal by Reversing Subarrays,sorting
Maximum Product of Two Elements in an Array,sorting
Maximum Area of a Piece of Cake After Horizontal and Vertical Cuts,sorting
The k Strongest Values in an Array,sorting
Allocate Mailboxes,sorting
Least Number of Unique Integers after K Removals,sorting
Find Critical and Pseudo-Critical Edges in Minimum Spanning Tree,sorting
Average Salary Excluding the Minimum and Maximum Salary,sorting
Number of Subsequences That Satisfy the Given Sum Condition,sorting
Can Make Arithmetic Progression From Sequence,sorting
Range Sum of Sorted Subarray Sums,sorting
Minimum Difference Between Largest and Smallest Value in Three Moves,sorting
Minimum Cost to Cut a Stick,sorting
Magnetic Force Between Two Balls,sorting
Maximum Number of Coins You Can Get,sorting
Put Boxes Into the Warehouse I,sorting
Put Boxes Into the Warehouse II,sorting
Check If String Is Transformable With Substring Sort Operations,sorting
Maximum Sum Obtained of Any Permutation,sorting
Alert Using Same Key-Card Three or More Times in a One Hour Period,sorting
Special Array With X Elements Greater Than or Equal X,sorting
Maximum Number of Visible Points,sorting
Mean of Array After Removing Some Elements,sorting
Best Team With No Conflicts,sorting
Arithmetic Subarrays,sorting
Sort Array by Increasing Frequency,sorting
Widest Vertical Area Between Two Points Containing No Points,sorting
Minimum Deletions to Make Character Frequencies Unique,sorting
Sell Diminishing-Valued Colored Balls,sorting
Determine if Two Strings Are Close,sorting
Minimum Initial Energy to Finish Tasks,sorting
Max Number of K-Sum Pairs,sorting
Stone Game VI,sorting
Maximum Height by Stacking Cuboids,sorting
Checking Existence of Edge Length Limited Paths,sorting
Maximum Units on a Truck,sorting
Largest Submatrix With Rearrangements,sorting
Maximum Number of Events That Can Be Attended II,sorting
Sort Features by Popularity,sorting
Minimum Absolute Sum Difference,sorting
Maximum Ice Cream Bars,sorting
Single-Threaded CPU,sorting
Frequency of the Most Frequent Element,sorting
Maximum Element After Decreasing and Rearranging,sorting
Closest Room,sorting
Minimum Interval to Include Each Query,sorting
Sorting the Sentence,sorting
Minimize Product Sum of Two Arrays,sorting
Minimize Maximum Pair Sum in Array,sorting
Get Biggest Three Rhombus Sums in a Grid,sorting
Count Pairs in Two Arrays,sorting
Reduction Operations to Make the Array Elements Equal,sorting
Minimum Space Wasted From Packaging,sorting
Maximum Product Difference Between Two Pairs,sorting
Eliminate Maximum Number of Monsters,sorting
Array With Elements Not Equal to Average of Neighbors,sorting
Minimum Difference Between Highest and Lowest of K Scores,sorting
Find the Kth Largest Integer in the Array,sorting
The Number of Weak Characters in the Game,sorting
GCD Sort of an Array,sorting
Find Original Array From Doubled Array,sorting
Maximum Earnings From Taxi,sorting
Average Height of Buildings in Each Segment,sorting
Minimum Operations to Make a Uni-Value Grid,sorting
Minimum Number of Moves to Seat Everyone,sorting
Sort Linked List Already Sorted Using Absolute Values,sorting
Two Best Non-Overlapping Events,sorting
Most Beautiful Item for Each Query,sorting
Maximum Number of Tasks You Can Assign,sorting
Find Target Indices After Sorting Array,sorting
Find All People With Secret,sorting
Finding 3-Digit Even Numbers,sorting
Subsequence of Size K With the Largest Even Sum,sorting
Find Subsequence of Length K With the Largest Sum,sorting
Recover the Original Array,sorting
Destroying Asteroids,sorting
Count Words Obtained After Adding a Letter,sorting
Earliest Possible Day of Full Bloom,sorting
Maximum Running Time of N Computers,sorting
Minimum Cost of Buying Candies With Discount,sorting
K Highest Ranked Items Within a Price Range,sorting
Count Elements With Strictly Smaller and Greater Elements,sorting
Keep Multiplying Found Values by Two,sorting
Minimum Sum of Four Digit Number After Splitting Digits,sorting
Sort Even and Odd Indices Independently,sorting
Smallest Value of the Rearranged Number,sorting
Removing Minimum Number of Magic Beans,sorting
Sort the Jumbled Numbers,sorting
Append K Integers With Minimal Sum,sorting
Find Players With Zero or One Losses,sorting
Largest Number After Digit Swaps by Parity,sorting
Maximum Total Beauty of the Gardens,sorting
Maximum Score of a Node Sequence,sorting
Count Number of Rectangles Containing Each Point,sorting
Number of Flowers in Full Bloom,sorting
Minimum Number of Keypresses,sorting
Maximum White Tiles Covered by a Carpet,sorting
Find Resultant Array After Removing Anagrams,sorting
Maximum Consecutive Floors Without Special Floors,sorting
Maximum Bags With Full Capacity of Rocks,sorting
Minimum Lines to Represent a Line Chart,sorting
Maximum Total Importance of Roads,sorting
Partition Array Such That Maximum Difference Is K,sorting
Successful Pairs of Spells and Potions,sorting
Find Minimum Time to Finish All Jobs II,sorting
The Latest Time to Catch a Bus,sorting
Minimum Sum of Squared Difference,sorting
Minimum Amount of Time to Fill Cups,sorting
Max Sum of a Pair With Equal Sum of Digits,sorting
Query Kth Smallest Trimmed Number,sorting
Minimum Deletions to Make Array Divisible,sorting
Finding the Number of Visible Mountains,sorting
Make Array Zero by Subtracting Equal Amounts,sorting
Merge Similar Items,sorting
Minimize Maximum Value in a Grid,sorting
Find the K-Sum of an Array,sorting
Longest Subsequence With Limited Sum,sorting
Meeting Rooms III,sorting
Divide Intervals Into Minimum Number of Groups,sorting
Maximum Matching of Players With Trainers,sorting
Minimum Money Required Before Transactions,sorting
Sort the People,sorting
Largest Positive Integer That Exists With Its Negative,sorting
Minimum Cost to Make Array Equal,sorting
Minimum Number of Operations to Make Arrays Similar,sorting
Next Greater Element IV,sorting
Most Popular Video Creator,sorting
Sort Array by Moving Items to Empty Space,sorting
Minimum Total Distance Traveled,sorting
Number of Distinct Averages,sorting
Divide Players Into Teams of Equal Skill,sorting
Maximum Star Sum of a Graph,sorting
Delete Greatest Value in Each Row,sorting
Longest Square Streak in an Array,sorting
Maximum Number of Points From Grid Queries,sorting
Reward Top K Students,sorting
Maximum Tastiness of Candy Basket,sorting
Maximum Subsequence Score,sorting
Sort the Students by Their Kth Score,sorting
Maximum Price to Fill a Bag,sorting
Put Marbles in Bags,sorting
Maximum Number of Integers to Choose From a Range I,sorting
Maximum Number of Integers to Choose From a Range II,sorting
Count the Number of Fair Pairs,sorting
Minimum Score by Changing Two Elements,sorting
Find the Maximum Number of Marked Indices,sorting
